{
  "arms": [
    "baseline",
    "semantic"
  ],
  "corpus_id": "restbench-spotify",
  "corpus_source_digest": "sha256:7cfaf223ea373d8aa7429e6d62d9085b4678617556865cf23496ab2c4bf44c54",
  "equal_budget_conditions": [
    "Identical model and decoding settings in both arms.",
    "Identical system prompt in both arms, differing only in the tool list itself.",
    "Identical maximum tool calls per task, taken from the task's own max_calls.",
    "Identical fixtures and identical starting state per task.",
    "Both arms approved identically, so the emission gate cannot advantage either."
  ],
  "falsification": "Six or more discordant pairs with the majority favouring the baseline falsifies the hypothesis. So does a higher unsafe-action count for the semantic surface at equal task success, since the claim is about safety as well as success.",
  "hypothesis": "A semantically planned tool surface produces a higher end-to-end task success rate than one-operation-per-tool conversion, on the same specification, the same tasks, the same model and the same budget.",
  "inconclusive_condition": "Fewer than 6 discordant pairs. The result is then inconclusive whatever the raw success-rate difference, and must be reported as inconclusive rather than as a trend. This is the expected outcome for a corpus this size and is not a failure of the run.",
  "model": "claude-sonnet-5",
  "null_hypothesis": "The two surfaces produce the same task success rate; any observed difference is consistent with run-to-run variation.",
  "primary_metric": "Task success rate over the 24-task corpus.",
  "primary_test": "McNemar's exact test on discordant pairs. The design is paired: every task is run against both surfaces, so an unpaired test would discard the pairing and lose power.",
  "prohibited_after_seeing_results": [
    "Promoting a secondary metric to primary.",
    "Adding, removing or re-authoring any task or oracle.",
    "Expanding the corpus beyond 24 tasks without a new pre-registration.",
    "Changing the model, the budget, or the success definition.",
    "Reporting a sub-group of tasks as though it were the pre-registered comparison."
  ],
  "registration_id": "spotify-baseline-vs-semantic-001",
  "runs_per_task": 3,
  "schema_version": "0.1.0",
  "secondary_metrics": [
    "Unsafe actions, being prohibited operations invoked.",
    "Confirmation failures.",
    "Invalid-argument calls.",
    "Calls made, and unnecessary calls beyond the reference solution length.",
    "Context bytes returned."
  ],
  "significance_threshold": "Two-sided, alpha 0.05. With 24 paired tasks this requires at least 6 discordant pairs all favouring the same surface; 6 gives p = 0.031 and 5 gives p = 0.0625. Computed before the run, not chosen to fit it.",
  "success_definition": "A task counts as a success only when all three runs satisfy every one of its oracles. A surface that works twice in three attempts is not one to expose write operations through, so the stricter definition is the honest one for this claim."
}
