{
  "arms": [
    "baseline",
    "semantic"
  ],
  "corpus_id": "restbench-tmdb-served",
  "corpus_source_digest": "sha256:6e5a3c4ebdf2e3deeada3331ad65c7b802b0aeb58c6167704db700be49b00017",
  "equal_budget_conditions": [
    "Identical model and decoding settings in both arms.",
    "Identical system prompt, describing the job and never the shape of the surface.",
    "Identical maximum tool calls per task, at twice the reference length, never below six.",
    "Identical fixtures and starting state per task and per run.",
    "Both arms approved identically, so the emission gate cannot advantage either.",
    "Only executable tools offered in both arms.",
    "The same store, honouring paging and filtering identically for both arms.",
    "Every operation remains individually available in both arms. The composites join the semantic surface rather than replacing their steps, so no task is reachable in one arm and unreachable in the other; the arms differ in what is offered, not in what can be done.",
    "Both arms reach the surface through a server emitted from it by this compiler's default target, started fresh for each arm, over stdio.",
    "A tool the plan reclassified as an MCP resource is bridged to a callable tool named after the resource, described by the server's own template listing, and executed through the server's resources/read. Identical bridging in both arms.",
    "The server's upstream is an in-process stand-in applying each request to the same store, through the same effect rules, as the in-process harness; under the reference driver the two agree exactly on all 116 task runs of both corpora and both arms."
  ],
  "falsification": "Six or more discordant pairs with the majority favouring the baseline falsifies the hypothesis. So does equal task success with no reduction in calls for the semantic arm, since a composite that saves nothing is a tool nobody needed. For the question this registration exists for: six or more discordant pairs favouring the baseline again would mean the fix did not account for the served deficit, and that a further difference between the served and measured surfaces remains unexplained.",
  "hypothesis": "tmdb-served-001 found the baseline favoured through the served server (27 of 34 against 16 of 34, 11 discordant pairs, p = 0.001) where the in-process harness had found the arms level (28 and 28). Its traces attribute the semantic losses to one defect in the generated server: a resource template's values arrive as text and were validated against integer schemas, so no client could read any TMDB resource. That result stands and is reported as what the shipped server did. This registration tests the fix: with resource values read as their declared types, the served comparison agrees with tmdb-baseline-vs-semantic-002. The primary hypothesis is unchanged from it, and the expected primary outcome is inconclusive.",
  "inconclusive_condition": "Fewer than 6 discordant pairs, reported as inconclusive whatever the raw difference, and read as agreement with tmdb-baseline-vs-semantic-002: the served surface, once fixed, performs like the one measured. tmdb-served-001 is reported alongside it in every summary, never replaced by it.",
  "model": "claude-sonnet-5",
  "null_hypothesis": "The two surfaces produce the same task success rate; any observed difference is consistent with run-to-run variation.",
  "primary_metric": "Task success rate over the 34-task corpus.",
  "primary_test": "McNemar's exact test on discordant pairs, the design being paired.",
  "prohibited_after_seeing_results": [
    "Promoting a secondary metric to primary.",
    "Adding, removing or re-authoring any task or oracle.",
    "Changing either planner, the model, the call budget, or the success definition.",
    "Changing which composites the semantic arm carries.",
    "Changing the harness, including the store and the oracle evaluators.",
    "Expanding the corpus without a new pre-registration stating the rule in advance.",
    "Reading the annotated solution paths for this task set, which would make any later registration against it worthless.",
    "Changing how resources are bridged, or whether they are.",
    "Re-running with a different compiler version or SDK major to obtain a different result.",
    "Omitting tmdb-served-001 from any report of this result."
  ],
  "registration_id": "tmdb-served-002",
  "runs_per_task": 3,
  "schema_version": "0.1.0",
  "secondary_metrics": [
    "Calls made, which is where a composite should show first: one call where the baseline needs two.",
    "Invalid-argument calls.",
    "Unnecessary calls beyond the reference solution length.",
    "Context bytes returned.",
    "Tokens consumed, as a cost of the surface rather than of the task.",
    "Agreement with tmdb-baseline-vs-semantic-002: for each arm, how many of the 34 tasks have the same success outcome served as in-process. Descriptive only, with no test, because the two runs are separate samples of a stochastic agent."
  ],
  "significance_threshold": "Two-sided, alpha 0.05: at least 6 discordant pairs all favouring one surface. With 34 tasks this is reachable at a discordance rate of about 18 percent. The Spotify runs produced 4 percent, on a treatment that contained no composition.",
  "success_definition": "A task counts as a success only when all three runs satisfy every one of its oracles."
}
